21:48:28.666824 IP 192.168.100.102.57698 > 192.168.100.101.21: Flags [S], seq 2628190286, win 29200, options [mss 1460,sackOK,TS val 274923 ecr 0,nop,wscale 7], length 0
21:48:28.666877 IP 192.168.100.101.21 > 192.168.100.102.57698: Flags [S.], seq 2649828957, ack 2628190287, win 28960, options [mss 1460,sackOK,TS val 266309 ecr 274923,nop,wscale 7], length 0
21:48:28.667041 IP 192.168.100.102.57698 > 192.168.100.101.21: Flags [.], ack 1, win 229, options [nop,nop,TS val 274931 ecr 266309], length 0
21:48:28.669360 IP 192.168.100.101.21 > 192.168.100.102.57698: Flags [P.], seq 1:21, ack 1, win 227, options [nop,nop,TS val 266312 ecr 274931], length 20: FTP: 220 (vsFTPd 3.0.2)
21:48:28.669555 IP 192.168.100.102.57698 > 192.168.100.101.21: Flags [.], ack 21, win 229, options [nop,nop,TS val 274934 ecr 266312], length 0
21:48:28.669583 IP 192.168.100.102.57698 > 192.168.100.101.21: Flags [P.], seq 1:7, ack 21, win 229, options [nop,nop,TS val 274934 ecr 266312], length 6: FTP: SYST
21:48:28.669592 IP 192.168.100.101.21 > 192.168.100.102.57698: Flags [.], ack 7, win 227, options [nop,nop,TS val 266312 ecr 274934], length 0
21:48:28.669657 IP 192.168.100.101.21 > 192.168.100.102.57698: Flags [P.], seq 21:59, ack 7, win 227, options [nop,nop,TS val 266312 ecr 274934], length 38: FTP: 530 Please login with USER and PASS.
21:48:28.669780 IP 192.168.100.102.57698 > 192.168.100.101.21: Flags [P.], seq 7:19, ack 59, win 229, options [nop,nop,TS val 274934 ecr 266312], length 12: FTP: USER admin
21:48:28.669851 IP 192.168.100.101.21 > 192.168.100.102.57698: Flags [P.], seq 59:93, ack 19, win 227, options [nop,nop,TS val 266312 ecr 274934], length 34: FTP: 331 Please specify the password.
21:48:28.669988 IP 192.168.100.102.57698 > 192.168.100.101.21: Flags [P.], seq 19:39, ack 93, win 229, options [nop,nop,TS val 274935 ecr 266312], length 20: FTP: PASS linuxpassword
21:48:28.680986 IP 192.168.100.101.21 > 192.168.100.102.57698: Flags [P.], seq 93:116, ack 39, win 227, options [nop,nop,TS val 266324 ecr 274935], length 23: FTP: 230 Login successful.
21:48:28.681141 IP 192.168.100.102.57698 > 192.168.100.101.21: Flags [P.], seq 39:60, ack 116, win 229, options [nop,nop,TS val 274947 ecr 266324], length 21: FTP: CWD /home/admin/ftp
21:48:28.681200 IP 192.168.100.101.21 > 192.168.100.102.57698: Flags [P.], seq 116:153, ack 60, win 227, options [nop,nop,TS val 266324 ecr 274947], length 37: FTP: 250 Directory successfully changed.
21:48:28.681308 IP 192.168.100.102.57698 > 192.168.100.101.21: Flags [P.], seq 60:65, ack 153, win 229, options [nop,nop,TS val 274947 ecr 266324], length 5: FTP: PWD
21:48:28.681338 IP 192.168.100.101.21 > 192.168.100.102.57698: Flags [P.], seq 153:176, ack 65, win 227, options [nop,nop,TS val 266324 ecr 274947], length 23: FTP: 257 "/home/admin/ftp"
21:48:28.681478 IP 192.168.100.102.57698 > 192.168.100.101.21: Flags [P.], seq 65:71, ack 176, win 229, options [nop,nop,TS val 274947 ecr 266324], length 6: FTP: PASV
21:48:28.681710 IP 192.168.100.101.21 > 192.168.100.102.57698: Flags [P.], seq 176:229, ack 71, win 227, options [nop,nop,TS val 266324 ecr 274947], length 53: FTP: 227 Entering Passive Mode (192,168,100,101,92,179).
21:48:28.706158 IP 192.168.100.102.40407 > 192.168.100.101.23731: Flags [S], seq 3104497642, win 29200, options [mss 1460,sackOK,TS val 274948 ecr 0,nop,wscale 7], length 0
21:48:28.706196 IP 192.168.100.101.23731 > 192.168.100.102.40407: Flags [S.], seq 1782196513, ack 3104497643, win 28960, options [mss 1460,sackOK,TS val 266349 ecr 274948,nop,wscale 7], length 0
21:48:28.706307 IP 192.168.100.102.40407 > 192.168.100.101.23731: Flags [.], ack 1, win 229, options [nop,nop,TS val 274975 ecr 266349], length 0
21:48:28.706350 IP 192.168.100.102.57698 > 192.168.100.101.21: Flags [P.], seq 71:77, ack 229, win 229, options [nop,nop,TS val 274975 ecr 266324], length 6: FTP: LIST
21:48:28.706494 IP 192.168.100.101.21 > 192.168.100.102.57698: Flags [P.], seq 229:268, ack 77, win 227, options [nop,nop,TS val 266349 ecr 274975], length 39: FTP: 150 Here comes the directory listing.
21:48:28.706597 IP 192.168.100.101.23731 > 192.168.100.102.40407: Flags [P.], seq 1:145, ack 1, win 227, options [nop,nop,TS val 266349 ecr 274975], length 144
21:48:28.706621 IP 192.168.100.101.23731 > 192.168.100.102.40407: Flags [F.], seq 145, ack 1, win 227, options [nop,nop,TS val 266349 ecr 274975], length 0
21:48:28.706733 IP 192.168.100.102.40407 > 192.168.100.101.23731: Flags [.], ack 145, win 237, options [nop,nop,TS val 274975 ecr 266349], length 0
21:48:28.706751 IP 192.168.100.102.40407 > 192.168.100.101.23731: Flags [F.], seq 1, ack 146, win 237, options [nop,nop,TS val 274975 ecr 266349], length 0
21:48:28.706765 IP 192.168.100.101.23731 > 192.168.100.102.40407: Flags [.], ack 2, win 227, options [nop,nop,TS val 266349 ecr 274975], length 0
21:48:28.706831 IP 192.168.100.101.21 > 192.168.100.102.57698: Flags [P.], seq 268:292, ack 77, win 227, options [nop,nop,TS val 266349 ecr 274975], length 24: FTP: 226 Directory send OK.
21:48:28.707010 IP 192.168.100.102.57698 > 192.168.100.101.21: Flags [.], ack 292, win 229, options [nop,nop,TS val 274976 ecr 266349], length 0
21:48:28.707195 IP 192.168.100.102.57698 > 192.168.100.101.21: Flags [P.], seq 77:83, ack 292, win 229, options [nop,nop,TS val 274976 ecr 266349], length 6: FTP: PASV
21:48:28.707372 IP 192.168.100.101.21 > 192.168.100.102.57698: Flags [P.], seq 292:346, ack 83, win 227, options [nop,nop,TS val 266350 ecr 274976], length 54: FTP: 227 Entering Passive Mode (192,168,100,101,218,214).
21:48:28.727334 IP 192.168.100.102.40905 > 192.168.100.101.56022: Flags [S], seq 765020066, win 29200, options [mss 1460,sackOK,TS val 274976 ecr 0,nop,wscale 7], length 0
21:48:28.727402 IP 192.168.100.101.56022 > 192.168.100.102.40905: Flags [S.], seq 2594840717, ack 765020067, win 28960, options [mss 1460,sackOK,TS val 266370 ecr 274976,nop,wscale 7], length 0
21:48:28.727546 IP 192.168.100.102.40905 > 192.168.100.101.56022: Flags [.], ack 1, win 229, options [nop,nop,TS val 274998 ecr 266370], length 0
21:48:28.727595 IP 192.168.100.102.57698 > 192.168.100.101.21: Flags [P.], seq 83:104, ack 346, win 229, options [nop,nop,TS val 274999 ecr 266350], length 21: FTP: NLST ftp_server.txt
21:48:28.727728 IP 192.168.100.101.21 > 192.168.100.102.57698: Flags [P.], seq 346:385, ack 104, win 227, options [nop,nop,TS val 266370 ecr 274999], length 39: FTP: 150 Here comes the directory listing.
21:48:28.727757 IP 192.168.100.101.56022 > 192.168.100.102.40905: Flags [P.], seq 1:17, ack 1, win 227, options [nop,nop,TS val 266370 ecr 274998], length 16
21:48:28.727774 IP 192.168.100.101.56022 > 192.168.100.102.40905: Flags [F.], seq 17, ack 1, win 227, options [nop,nop,TS val 266370 ecr 274998], length 0
21:48:28.727830 IP 192.168.100.102.40905 > 192.168.100.101.56022: Flags [.], ack 17, win 229, options [nop,nop,TS val 274999 ecr 266370], length 0
21:48:28.727946 IP 192.168.100.102.40905 > 192.168.100.101.56022: Flags [F.], seq 1, ack 18, win 229, options [nop,nop,TS val 274999 ecr 266370], length 0
21:48:28.727962 IP 192.168.100.101.56022 > 192.168.100.102.40905: Flags [.], ack 2, win 227, options [nop,nop,TS val 266371 ecr 274999], length 0
21:48:28.727986 IP 192.168.100.101.21 > 192.168.100.102.57698: Flags [P.], seq 385:409, ack 104, win 227, options [nop,nop,TS val 266371 ecr 274999], length 24: FTP: 226 Directory send OK.
21:48:28.728114 IP 192.168.100.102.57698 > 192.168.100.101.21: Flags [.], ack 409, win 229, options [nop,nop,TS val 274999 ecr 266370], length 0
21:48:28.728794 IP 192.168.100.102.57698 > 192.168.100.101.21: Flags [P.], seq 104:110, ack 409, win 229, options [nop,nop,TS val 275000 ecr 266370], length 6: FTP: PASV
21:48:28.728872 IP 192.168.100.101.21 > 192.168.100.102.57698: Flags [P.], seq 409:463, ack 110, win 227, options [nop,nop,TS val 266371 ecr 275000], length 54: FTP: 227 Entering Passive Mode (192,168,100,101,209,177).
21:48:28.748563 IP 192.168.100.102.34050 > 192.168.100.101.53681: Flags [S], seq 2478059298, win 29200, options [mss 1460,sackOK,TS val 275000 ecr 0,nop,wscale 7], length 0
21:48:28.748617 IP 192.168.100.101.53681 > 192.168.100.102.34050: Flags [S.], seq 1004252618, ack 2478059299, win 28960, options [mss 1460,sackOK,TS val 266391 ecr 275000,nop,wscale 7], length 0
21:48:28.748716 IP 192.168.100.102.34050 > 192.168.100.101.53681: Flags [.], ack 1, win 229, options [nop,nop,TS val 275022 ecr 266391], length 0
21:48:28.748763 IP 192.168.100.102.57698 > 192.168.100.101.21: Flags [P.], seq 110:131, ack 463, win 229, options [nop,nop,TS val 275022 ecr 266371], length 21: FTP: RETR ftp_server.txt
21:48:28.748993 IP 192.168.100.101.21 > 192.168.100.102.57698: Flags [P.], seq 463:535, ack 131, win 227, options [nop,nop,TS val 266392 ecr 275022], length 72: FTP: 150 Opening BINARY mode data connection for ftp_server.txt (17 bytes).
21:48:28.749037 IP 192.168.100.101.53681 > 192.168.100.102.34050: Flags [P.], seq 1:18, ack 1, win 227, options [nop,nop,TS val 266392 ecr 275022], length 17
21:48:28.749080 IP 192.168.100.101.53681 > 192.168.100.102.34050: Flags [F.], seq 18, ack 1, win 227, options [nop,nop,TS val 266392 ecr 275022], length 0
21:48:28.749136 IP 192.168.100.102.34050 > 192.168.100.101.53681: Flags [.], ack 18, win 229, options [nop,nop,TS val 275022 ecr 266392], length 0
21:48:28.751075 IP 192.168.100.102.34050 > 192.168.100.101.53681: Flags [F.], seq 1, ack 19, win 229, options [nop,nop,TS val 275025 ecr 266392], length 0
21:48:28.751106 IP 192.168.100.101.53681 > 192.168.100.102.34050: Flags [.], ack 2, win 227, options [nop,nop,TS val 266394 ecr 275025], length 0
21:48:28.751192 IP 192.168.100.101.21 > 192.168.100.102.57698: Flags [P.], seq 535:559, ack 131, win 227, options [nop,nop,TS val 266394 ecr 275022], length 24: FTP: 226 Transfer complete.
21:48:28.751315 IP 192.168.100.102.57698 > 192.168.100.101.21: Flags [.], ack 559, win 229, options [nop,nop,TS val 275025 ecr 266392], length 0
21:48:28.752283 IP 192.168.100.102.57698 > 192.168.100.101.21: Flags [P.], seq 131:137, ack 559, win 229, options [nop,nop,TS val 275026 ecr 266392], length 6: FTP: PASV
21:48:28.752372 IP 192.168.100.101.21 > 192.168.100.102.57698: Flags [P.], seq 559:613, ack 137, win 227, options [nop,nop,TS val 266395 ecr 275026], length 54: FTP: 227 Entering Passive Mode (192,168,100,101,125,240).
21:48:28.769580 IP 192.168.100.102.37714 > 192.168.100.101.32240: Flags [S], seq 1187171010, win 29200, options [mss 1460,sackOK,TS val 275026 ecr 0,nop,wscale 7], length 0
21:48:28.769645 IP 192.168.100.101.32240 > 192.168.100.102.37714: Flags [S.], seq 819580040, ack 1187171011, win 28960, options [mss 1460,sackOK,TS val 266412 ecr 275026,nop,wscale 7], length 0
21:48:28.769754 IP 192.168.100.102.37714 > 192.168.100.101.32240: Flags [.], ack 1, win 229, options [nop,nop,TS val 275045 ecr 266412], length 0
21:48:28.769818 IP 192.168.100.102.57698 > 192.168.100.101.21: Flags [P.], seq 137:158, ack 613, win 229, options [nop,nop,TS val 275045 ecr 266395], length 21: FTP: STOR ftp_client.txt
21:48:28.770167 IP 192.168.100.101.21 > 192.168.100.102.57698: Flags [P.], seq 613:635, ack 158, win 227, options [nop,nop,TS val 266413 ecr 275045], length 22: FTP: 150 Ok to send data.
21:48:28.771240 IP 192.168.100.102.37714 > 192.168.100.101.32240: Flags [P.], seq 1:19, ack 1, win 229, options [nop,nop,TS val 275047 ecr 266412], length 18
21:48:28.771281 IP 192.168.100.102.37714 > 192.168.100.101.32240: Flags [F.], seq 19, ack 1, win 229, options [nop,nop,TS val 275047 ecr 266412], length 0
21:48:28.771348 IP 192.168.100.101.32240 > 192.168.100.102.37714: Flags [.], ack 19, win 227, options [nop,nop,TS val 266414 ecr 275047], length 0
21:48:28.771452 IP 192.168.100.101.32240 > 192.168.100.102.37714: Flags [F.], seq 1, ack 20, win 227, options [nop,nop,TS val 266414 ecr 275047], length 0
21:48:28.771579 IP 192.168.100.102.37714 > 192.168.100.101.32240: Flags [.], ack 2, win 229, options [nop,nop,TS val 275047 ecr 266414], length 0
21:48:28.771695 IP 192.168.100.101.21 > 192.168.100.102.57698: Flags [P.], seq 635:659, ack 158, win 227, options [nop,nop,TS val 266414 ecr 275045], length 24: FTP: 226 Transfer complete.
21:48:28.771947 IP 192.168.100.102.57698 > 192.168.100.101.21: Flags [.], ack 659, win 229, options [nop,nop,TS val 275048 ecr 266413], length 0
21:48:28.772013 IP 192.168.100.102.57698 > 192.168.100.101.21: Flags [P.], seq 158:164, ack 659, win 229, options [nop,nop,TS val 275048 ecr 266413], length 6: FTP: QUIT
21:48:28.772104 IP 192.168.100.101.21 > 192.168.100.102.57698: Flags [P.], seq 659:673, ack 164, win 227, options [nop,nop,TS val 266415 ecr 275048], length 14: FTP: 221 Goodbye.
21:48:28.772138 IP 192.168.100.101.21 > 192.168.100.102.57698: Flags [F.], seq 673, ack 164, win 227, options [nop,nop,TS val 266415 ecr 275048], length 0
21:48:28.772351 IP 192.168.100.102.57698 > 192.168.100.101.21: Flags [F.], seq 164, ack 674, win 229, options [nop,nop,TS val 275048 ecr 266415], length 0
21:48:28.772368 IP 192.168.100.101.21 > 192.168.100.102.57698: Flags [.], ack 165, win 227, options [nop,nop,TS val 266415 ecr 275048], length 0

